video_id,video_link,channel_id,query,title,description,channel,published_at,subscriber_count,tags,view_count,like_count,comment_count,engagement_score
YC9yBkHPO4g,https://www.youtube.com/watch?v=YC9yBkHPO4g,UCPepW85ZIS0Gls_ik2V7HMA,tool restoration,VINTAGE TOOL FLIPS RAZOR SHARP AGAIN,A hand-cranked Allegro razor blade sharpener from 1930s Switzerland restores a vintage dual-edge steel blade on a spinning ...,Echoes of Honor,2026-05-23T16:00:44Z,47800,e dual-edge steel blade on a spinning hone stone,12780813,75386,1267,13560013
AYBkasFAm64,https://www.youtube.com/watch?v=AYBkasFAm64,UCHVDJ3yUaFuEunlHDjj0HsQ,furniture flip,I Can’t Say “No” to Furniture Turds 😳 | 1900s Desk Makeover #beforeandafter,Would you have saved this one… or put it on the burn pile This early 1900s typewriter desk was in rough shape. Failing veneer ...,Grace Holbrook | DIY + FLIPS,2026-05-04T20:19:12Z,199000,,5573556,317815,5568,8863066
zlnJGTyxs9E,https://www.youtube.com/watch?v=zlnJGTyxs9E,UCo07djKdqDzAQlMeV-DpTIQ,restoration hacks,Inner Tube Hack! #shorts #MechanicLife #satisfyingfix #motorcyclebuild #restoration,,DR. Creative Design,2026-04-22T18:00:56Z,76600,#shorts #MechanicLife #satisfyingfix #motorcyclebuild #restoration,6632972,61400,914,7265252
PFCBpJQtMlo,https://www.youtube.com/watch?v=PFCBpJQtMlo,UCYoLSF9gcwe87Q-V2b47FfA,tool restoration,Best Tools For Restoration,Best Tools For Restoration #mechanic #mechanicjack #restoration #craftsmanship #oldschool #rusty.,Mechanic Jack,2026-04-24T15:59:11Z,1100000,"restoration, craftsmanship, old school, mechanic, automobile, mechanic jack, panel beater, mechanical engineering, trucks, fix truck, engine overhaul, transmission, bearings, wheel side, car maintenance, auto detailing, car wash, engine assembly, tutorials, guide, transmission repair, mechanic jack repair, truck mechanic, mechanic work, car jack repair, toyota transmission rebuild, mechanic training, car engine repair, automotive mechanic, automatic transmission",5560177,74563,643,6318667
RA6_xhLuGwk,https://www.youtube.com/watch?v=RA6_xhLuGwk,UCB9avz9mkcGOEZq1q80H1OQ,construction power tool hacks,Electric Concrete Leveling &amp; Finishing Tool – Ultimate Construction Hack‎,"Working Principle: ‎1. Motor delivers combined impact and rotary force to the wide chisel bit ‎2. Bit scrapes, shaves, and levels ...","keep working""",2026-05-26T14:00:16Z,12600,,5664900,6558,38,5731240
9m03OxVMMmw,https://www.youtube.com/watch?v=9m03OxVMMmw,UCHVDJ3yUaFuEunlHDjj0HsQ,dresser makeover,It’s Not Destroying Furniture If I Saved It… Look What Happened 👀🔥 | Desk Makeover #furnitureflip,This piece was literally on its way out… and now it's getting a second life. Not everything old is “antique” in the way people think.,Grace Holbrook | DIY + FLIPS,2026-04-06T20:43:21Z,199000,,3762328,183422,5478,5706108
rrBcN78mYNs,https://www.youtube.com/watch?v=rrBcN78mYNs,UCsDGIEMnO59w4XZlWlYCWSQ,angle grinder projects,🛠️🔥 ANGLE GRINDER + SAW BLADE = INSANE TOOL HACK 😱⚙️ | Genius DIY Upgrade You Didn’t Expect,A creative DIY workshop project revealing how a simple angle grinder and saw blade can be transformed into a powerful custom ...,Odd Builds,2026-04-24T10:30:37Z,3080,,4108004,25568,380,4371284
TJfWNevEe1U,https://www.youtube.com/watch?v=TJfWNevEe1U,UCHVDJ3yUaFuEunlHDjj0HsQ,furniture flip,Before You Paint Furniture… Watch This 👀 | Desk Makeover #furnitureflip,This is the piece that made me stop painting everything. Under layers of old paint (yes… even lead paint) was beautiful wood just ...,Grace Holbrook | DIY + FLIPS,2026-03-02T20:51:18Z,199000,,2057039,146115,1787,3553929
ZKoBtmsZIpw,https://www.youtube.com/watch?v=ZKoBtmsZIpw,UCCRhU9CwWCR1I4K0vTmZ4bw,tool restoration,Restoring a old rusty 1938&#39;s Razor Blade Sharpener! ⚙️ #vintage #restoration,"Watch this satisfying restoration transformation as I bring an old rusty item back to life. From heavy rust removal to deep cleaning, ...",Rust Bench,2026-05-24T03:00:35Z,3320,"restoration, satisfying restoration, rust removal, tool restoration, antique restoration, metal restoration, restoring old tools, vintage restoration, oddly satisfying, restoration videos, before and after restoration, restoration ASMR, DIY restoration, workshop restoration, rusty tools restoration, deep cleaning, satisfying videos, tool repair, restoring rusty items, metal polishing, cleaning rust, restoration project, old tool restoration, extreme restoration, shorts",3017775,33835,321,3362545
neJqjdj9NUY,https://www.youtube.com/watch?v=neJqjdj9NUY,UC8voJ9Sjb9tdf2jVByTKlFQ,thrift flip,After YEARS of not sewing (I’m BACK BABY)🥳 #vintagefashion #1940sfashion #thriftflip,,Gabi Jones,2026-05-03T20:41:22Z,1290000,,987020,68774,325,1681260
9zvnsApjEVE,https://www.youtube.com/watch?v=9zvnsApjEVE,UC2rzsm1Qi6N1X-wuOg_p0Ng,power tools latest use cases,I Replaced 10 Power Tools With My Drill!,"DeWalt PVC/PEX Cutter, Chainsaw, Universal Socket, DeWalt Metal Shear, Strap Winder, Auger, DeWalt Copper Pipe Cutter, ...",Project Farm,2026-04-12T16:50:01Z,3860000,"drill attachments, dangerous drill attachments, power drill accessories, DeWalt PVC PEX cutter, drill chainsaw attachment, universal socket, DeWalt metal shear, strap winder, drill auger bit, DeWalt copper pipe cutter, deburring tool, chamfer deburring bit, drum sander, drill brush set, flexible drill bit extension, wire brush set, drill water pump, carbide burr set, vegetation cutter, drill circular saw, drill reciprocating saw, drill rivet gun, angle drill attachment",1172938,42883,3376,1669288
RoS7A2cxX4c,https://www.youtube.com/watch?v=RoS7A2cxX4c,UC1vIEpH2DMdzJ1K84bmBMFA,restoration projects,ASMR Restoration Project 😱- Titan OPTIMUS PRIME Abandoned in a Deep Forest for Years Fully Restored,"Step Inside a deep within an overgrown forest where rusted metal disappears beneath vines and towering trees, a fallen titan ...",Z Processing,2026-03-03T21:16:41Z,24800,,1473653,5164,106,1527413
mUdYFmCFLxo,https://www.youtube.com/watch?v=mUdYFmCFLxo,UCl4Nn-uhNMXQNfvkuYvtIyA,angle grinder projects,⚙️ Turning an Old Motor into a Bench Grinder,This workshop conversion project transforms an old electric motor into a functional bench grinder using a custom shaft adapter ...,WeAreWorking,2026-05-22T10:45:02Z,408000,,1492444,1888,3,1511384
xT-BNANotH4,https://www.youtube.com/watch?v=xT-BNANotH4,UCHVDJ3yUaFuEunlHDjj0HsQ,furniture flip,Is It Cute or Is It Dog UGLY? 🫠 | Antique Dresser Furniture Flip #beforeandafter,"Is it cute or is it dog ugly? Picked up this antique chest of drawers at a garage sale looking ROUGH. Missing key, 2/3 locks, ...",Grace Holbrook | DIY + FLIPS,2026-05-11T20:21:52Z,199000,,896095,52193,1622,1450465
N6B7wdRPw5o,https://www.youtube.com/watch?v=N6B7wdRPw5o,UC8voJ9Sjb9tdf2jVByTKlFQ,thrift flip,Honestly sometimes I have to make mistakes to learn 🤷‍♀️ #sewing #thriftflip,,Gabi Jones,2026-05-14T20:59:01Z,1290000,,790854,38124,256,1177214
9ef3teK91Qc,https://www.youtube.com/watch?v=9ef3teK91Qc,UC_x7l0a-7MGj3Wkk2weOhwQ,furniture flip,$50 Thrift Furniture Flip Challenge #thrifting #furnitureflipping,,New Life by Noah,2026-04-26T20:13:14Z,163000,,810863,29480,648,1118623
D949pAa2KXY,https://www.youtube.com/watch?v=D949pAa2KXY,UCHcM1kt7e0LxXe-O8l5dRhQ,restoration projects,From Rusty Tank to Stunning Modern Home | Satisfying Transformation Timelapse,Watch an incredible transformation as an old rusty tank is turned into a beautiful modern glass home surrounded by nature.,Inspiration Me,2026-05-05T21:00:14Z,3270,"rusty tank transformation, tank to house, satisfying timelapse, tiny house build, modern glass house, industrial design home, diy transformation, restoration timelapse, building process, architecture design, spiral staircase house, glass house design, small space living, container style home, home renovation timelapse, satisfying build video, realistic timelapse, construction process, before and after transformation, nature house design, construction process step by step",949655,13410,113,1086015
BQezpImQl1U,https://www.youtube.com/watch?v=BQezpImQl1U,UCYoCImzdf0o7ymAEHMzLLyw,furniture flip,Beginner friendly nightstand makeover! ✨ #furnitureflip #furnituremakeover #furniture #diy,Beginner friendly nightstand makeover tutorial I'm using the new @dixiebellepaint Chalk Mineral Paint Colors for this project!,THE FLIPPED PIECE,2026-05-19T20:31:33Z,713000,,726972,27298,388,1007712
ZwL2CrcgRhA,https://www.youtube.com/watch?v=ZwL2CrcgRhA,UCip1Vr1X79WL0x-SJJ2383g,tool restoration,63 Dollar Snap-on Impact Restoration...was it worth it,"Welcome to the channel! In this restoration video, I bring a Snap-on XT7100 impact wrench back to life—picked up on eBay for ...",Rebuilt & Restored,2026-04-11T20:11:36Z,115000,"Restoration videos, Restoration, snap on, snapon, snapon restorations, restore, rust, restorations, restoration video, impact restoration, impact wrench, rebuild, xt7100, xt7100 rebuild, Snap on Ratchet restoration, snap on jack restoration, snap on vise restoration, Rebuilt and restored, rebuilt & restored, resoration, Restoraion",704783,8980,470,803983
LjiAClETf-g,https://www.youtube.com/watch?v=LjiAClETf-g,UCj4ivi1rRz-v-W-gwT37LPg,restoration projects,I Restored the World’s Tiniest Car… Look What Happened 😱 (Full Restoration),"I restored the world's tiniest car… and the result is unbelievable. What started as a tiny, worn-out microcar turned into an ...",Blackstone Motor Works,2026-04-08T17:05:00Z,2680,,661082,4717,14,708532
ldb0i5mRfNs,https://www.youtube.com/watch?v=ldb0i5mRfNs,UCu8YylsPiu9XfaQC74Hr_Gw,restoration hacks,Restoring The Bike I Rode in 2001,"I bought a bike nearly identical to my MTB from 2001, but it needed some serious work. In this video I break this bike down to the ...",Berm Peak,2026-03-13T15:01:21Z,2760000,"mtb, mountain bike, bike repair, cycling, outdoors, flipbike",482184,16397,1293,672014
8pAB5_36o1Q,https://www.youtube.com/watch?v=8pAB5_36o1Q,UCWDItgvazSzsyqgeCOnv5Uw,restoration projects,We Built a Dream Treehouse Home for an Elderly Couple Living in a Broken Shelter | Full Timelapse,"An elderly couple had been living in a worn-out shelter beneath a tree for years. In this heartwarming restoration project, we ...",Sakura,2026-05-27T16:08:29Z,3850,"treehouse build, treehouse timelapse, home transformation, before and after, construction timelapse, restoration project, luxury treehouse, elderly couple, heartwarming story, viral transformation, treehouse, construction, dream treehouse, treehouse transformation, construction project, building process, home build, house construction, windstorm aftermath, disaster recovery, helping elderly, satisfying video, amazing transformation, forest retreat, youtube viral",560914,4028,47,602134
gLSxt4fF5qQ,https://www.youtube.com/watch?v=gLSxt4fF5qQ,UCf76T9N5p21HMDWhaWJzC2Q,angle grinder projects,This idea will shock billions of farmers! Turn an angle grinder into a million-dollar tool 🔥,"Hello everyone! You are watching video "" This idea will shock billions of farmers! Turn an angle grinder into a million-dollar tool ...",Inventor K,2026-04-25T13:01:23Z,618000,"DIY, Invention, Recycle, reuse, life hacks, unknown tips, crafts idea, INVENTOR K, chainsaw, saw blade, wood saw, wood cutter, convertible angle grinder, angle grinder, angle grinder chainsaw, angle grinder hacks, angle grinder attachment, diy chainsaw, homemade chainsaw, chainsaw diy, turning angle grinder into chainsaw, diy tools, homemade tools, power tools diy, workshop tools, tool invention, diy invention, brilliant idea, garage tools, mechanical diy, metalworking diy",552001,2159,136,576311
by6FWTAwfDM,https://www.youtube.com/watch?v=by6FWTAwfDM,UCYpSqQvrlGw4UTVFfMpGzjw,DIY power tools trends,You NEED to 3D Print These for March 2026,Get the Wolfbox MF200 Compressed Air Duster: https://geni.us/MF-200 Code: WOLFBOXMF200 (19% off) Wolfbox Dash Cam ...,engineericly,2026-03-09T14:33:37Z,759000,"engineericly, 3d prints, 3d printing, 3d printed, stl, stl file, useful 3d prints, thingiverse, 3d printer in action, print in place, top 3d prints, cool 3d prints, best 3d prints, 3d print model, functional prints, practical prints, practical 3d prints, awesome 3d prints, cool things to 3d print, 3d printing ideas, top 3d printing ideas, top useful 3d prints, 3d printing business, 2026",466923,5666,169,526963
p1-plzI7zlI,https://www.youtube.com/watch?v=p1-plzI7zlI,UCasG9kJWi1eVxM0QkyqKVJQ,tool restoration,1940s Japanese Noodle Maker [Restoration],This restoration is on a Ono Noodle Maker (Type 3) made by the Ono Machinery Manufacturing Co. of Japan sometime near the ...,Hand Tool Rescue,2026-03-14T12:16:06Z,1200000,,290790,19067,1003,501520
gKXsWNS59tI,https://www.youtube.com/watch?v=gKXsWNS59tI,UCSpi38FwfeHMBIkyXlQtiEA,construction power tool hacks,Fastest Circular Saw Cutting Trick for Framing Crews!,Fastest Circular Saw Cutting Trick for Framing Crews! A cordless circular saw is used to make fast and accurate cuts for framing ...,SnapBuild,2026-05-29T08:00:36Z,5460,"circular saw cutting, cordless saw, framing lumber",474458,449,1,478968
K1gK8KzMpi4,https://www.youtube.com/watch?v=K1gK8KzMpi4,UCu_2HbORc6phCSeD5McAf9A,furniture restoration,Most people think I&#39;m crazy for doing this to antiques #furniture #restoration #diy,"This is what I'm using https://urlgeni.us/amzn/5iK5kw ""Why do you use with water?!"" The question I've been asked hundreds of ...",Saved By Design,2026-05-24T13:00:32Z,32200,,393114,5135,131,447084
cTTJN0Ghz0I,https://www.youtube.com/watch?v=cTTJN0Ghz0I,UC2Lytl7fJ6LZvCUuZxHrCFA,angle grinder projects,Clever Angle Grinder Idea With Small Metal Plates – You’ll Be Surprised How It Works!,"Who would have thought small metal plates and an angle grinder could become such a clever DIY workshop idea? In this video, I ...",Brain Inventor,2026-05-15T13:00:35Z,227000,"Brain Inventor, USA, DIY, Shorts, angle grinder hack, grinder attachment, grinder modification, angle grinder project, DIY workshop tool, hand tools, power tools, simple DIY tool, final test result, how to make, angle grinder attachment, workshop ideas, DIY power tools, DIY Invention, Genius DIY, Creative Tech, Handmade Tools, Amazing Idea, Smart Hack, How to make, Restoration, Transformation, Secret Trick, Million Dollar Hack, Battery Repair, Scrap Metal Art",349585,4477,15,394655
mP2kigvNfto,https://www.youtube.com/watch?v=mP2kigvNfto,UC8AvcEE8l8mHs-rZTXoynVQ,tool restoration,I Restored my Grandfather&#39;s Rusty Ratchet Wrench,Thanks for watching the video ! Hope you enjoyed it ! PATREON https://www.patreon.com/ladb FACEBOOK ...,LADB Restoration,2026-03-27T16:00:56Z,1130000,"restoration, restore, antique, old, rusty, tool, how to restore, rust, restaurar, restauration, restauracion, old tools, vieux outils, restoring, restoring tools, antique tools, restoration old things, good restoration, rescue, old items, repair, tool repair, ladb, ladb restoration, agriculture tools, agricultural machines",279023,10318,184,385883
va2NF0ZQjpQ,https://www.youtube.com/watch?v=va2NF0ZQjpQ,UCcPuAb6RtYsoJYdZyc4jrVQ,power tools latest use cases,14 NEW Tools &amp; Tech from the 2026 AHR Tool Expo!,Rob and Sarah find NEW TOOLS at the 2026 AHR tool expo in Las Vegas Convention Center. New power tools and technology ...,Tool Show,2026-05-02T16:01:31Z,257000,"power tool news, new power tools, new milwaukee tools, new makita tools, new dewalt tools, new bosch tools, new flex tools, new ryobi tools, new hart tools, new ego tools",338586,2988,55,369566
5pABsVua_60,https://www.youtube.com/watch?v=5pABsVua_60,UCawPwx5Wmw-lRuu9YRI1FWg,cordless drill projects,Turn Your Drill Into a Chainsaw Sharpener! 🇺🇸⚡ #tools #chainsaw #DIY,TITLE: Turn Your Drill Into a Chainsaw Sharpener! ⚡ #tools #chainsaw #DIY 3 HASHTAGS: #tools #chainsaw #DIY ...,TRADISIONAL CARPENTRY,2026-05-29T16:00:37Z,20600,"chainsaw, DIY, tools",359509,404,3,363609
spSPfFxJCis,https://www.youtube.com/watch?v=spSPfFxJCis,UCNo7yfVy58QJ_huJRuGQgaA,woodworking power tools projects,DIY Live Edge Wood Sink Transformation,"Transforming a raw, live-edge slab of wood into a stunning, functional luxury piece. Watch the step-by-step process of carving, ...",MyCr3ation,2026-05-25T11:12:23Z,307,"MyCr3ation, construction process, house construction, home building, tiny house build, site clearing, concrete pouring, architecture shorts, ai, stisfaction, shorts, Ai, Ai videos",323032,1627,34,339982
BkL_ripjZOI,https://www.youtube.com/watch?v=BkL_ripjZOI,UCmhIMXOlLIscVcWW9gYybpw,furniture restoration,"What happens when the furniture restorer can do, what he wants","My restoration book, paperback version: AMAZON US: https://www.amazon.com/dp/B0GJQVC7MJ AMAZON EU: ...",AT Restoration,2026-05-09T15:00:29Z,345000,antique funiture restoration,181415,13336,929,333355
6-BWaRKXgSg,https://www.youtube.com/watch?v=6-BWaRKXgSg,UCzr30osBdTmuFUS8IfXtXmg,power tools latest use cases,Angle Grinders: The Most Versatile Tool in the Shop,Enter Your Project into The '26 EC Buildoff and win big https://www.essentialcraftsman.com/buildoff The Angle Grinder might ...,Essential Craftsman,2026-05-06T16:46:35Z,1840000,"mentor, trades, tradesman, career, builder, wisdom, workbench, tools, tips, trick, essential craftsman, scott wadsworth, tool tips, pro tips, how to be a contractor, diy tips, diy, angle Grinder, shop angle grinder, using an angle grinder, how to use an angle grinder, angle grinder safety",249063,7006,488,328883
bC2kZxw3ai4,https://www.youtube.com/watch?v=bC2kZxw3ai4,UCLzKj6B87NnLHBBCRSgbKvQ,impact driver uses,Prying Free Debris: Removing Stuck Rocks from Heavy Truck Tires,On-Site Tire Debris Removal: Practical Solutions for Roadside Vehicle Maintenance Large transport trucks travel long distances ...,Interesting Tasty Farm,2026-05-30T13:44:49Z,245000,,323078,488,1,327978
ZwhKzpU4b2E,https://www.youtube.com/watch?v=ZwhKzpU4b2E,UC-p60OPSzeFHQ2ehRNwdwTg,dresser makeover,EXTREME painted furniture MAKEOVER,"This 1930s Art Deco vanity was painted purple when we found it! We painstakingly stripped the paint, and found AMAZING veneer ...",Art Deco Furniture,2026-05-14T17:00:41Z,16000,"wood repair, furniture restoration, blendal powders, furniture touchup",264322,5254,238,321622
tXCA4iggBuA,https://www.youtube.com/watch?v=tXCA4iggBuA,UCSLClJLzdUMRMe0E4SPfc-w,DIY power tools trends,NEVER Use a Router Like This (Most Beginners Do),The router is the most intimidating tool in the shop for most beginners — and the most misused. In this video I break down the five ...,731 Woodworks,2026-03-21T11:01:24Z,910000,,244124,5811,267,307574
ykSfiHlw-jc,https://www.youtube.com/watch?v=ykSfiHlw-jc,UCbJ8oD5Gmh6CKv0GPpXpK8w,DIY power tools trends,Cheap vs Pro Tools - Are You Wasting Money?,"In this video, I'm putting Ryobi's DIY-focused power tools up against their professional equivalents. We'll be testing some of the ...",The DIY Guy,2026-03-28T15:00:00Z,701000,"ryobi, best new tools, ryobi tools, cheap tools, diy tools, cheap power tools, woodworking, cordless tools, woodworking for beginners, diy, tools, power tool reviews, diy guy, the diy guy, diy guy tools, tool comparison, power tools, ryobi one plus, milwaukee tools, tool review",215384,5941,1289,300574
6ATjZIm5D-k,https://www.youtube.com/watch?v=6ATjZIm5D-k,UCUYlSrRVd4CWY3yGSyKd-pg,restoration hacks,Watching Self Made Metal Tongs Pop Rigid Plastic Fasteners ✨,"When performing delicate interior trim restoration or automotive wiring layout, technicians frequently encounter stubborn plastic ...",Working Planet Shorts,2026-05-31T07:10:34Z,489000,,291843,736,1,299223
mPbn4FEnCRU,https://www.youtube.com/watch?v=mPbn4FEnCRU,UCe_5cyghC66jIC64KnUs77w,restoration hacks,Restore Old Headlights to NEW in 1 Minute with WD-40! Genius Trick,"Hello everyone! You are watching the video: ""Restore Old Headlights to NEW in 1 Minute with WD-40! Genius Trick"" Discover ...",DIY Hacks,2026-03-11T12:00:00Z,81500,"DIY, invention, crafts, homemade, recycling, US, america, howto, DIY hacks, do it yourself, DIY projects, life hacks, tips and tricks, creative ideas, how to make, craft ideas, DIY ideas, how to, tutorial, ideas, tools, tips, projects, hacks, diy ideas, restore, restoration, how to clean, like new, headlights, old headlights, how to clean headlights, how to polish headlights, faded headlights, foggy headlights, blur headlights, car lights, how to restore foggy headlights, wd-30",273742,1930,68,294402
Q_SjSykUZYI,https://www.youtube.com/watch?v=Q_SjSykUZYI,UCLRXnLfkB2ZfSyNCyji_yVg,construction power tool hacks,"Part 56| Skilled Worker Hacks: Fast, Safe, Accurate ✅ #smart #construction","Looking for Skilled Worker Hacks: Fast, Safe, Accurate? This video shares practical tips to improve your daily construction work.",Construction VPM,2026-05-25T17:36:52Z,133000,,244982,4030,9,285462
q8Q0Q_Hkr84,https://www.youtube.com/watch?v=q8Q0Q_Hkr84,UCcG7pGPL4uSpUutKdPa6eoA,restoration hacks,Millions Don’t Know This Trick! Pour Vinegar into Old Batteries — Amazing Results!,Hello everyone! You are watching video: Millions Don't Know This Trick! Pour Vinegar into Old Batteries — Amazing Results!,DIY Tool Revival,2026-04-04T12:01:32Z,3270,"DIY repair, Inventor Hacks, old battery, Restores Old Batteries, New Batteries, restore old battery, revive dead battery, battery life hack, diy battery repair, save money diy, Old Battery Like New in 1 Minute, Quick Way to Restore Your Battery, Old Battery Like New, Restore Your Battery, Battery, DIY Tool Revival, diy tool revival, diytoolrevival, BatteryHack, RestoreBattery, LifeHack, SaveMoney, InventorHacks, DIYTools, Pour Vinegar into Old Batteries, Millions Don’t Know This Trick",211610,5575,510,277560
cqctmp8p6r0,https://www.youtube.com/watch?v=cqctmp8p6r0,UC5u803Jv60OMquJMtwUyoGg,furniture flip,I Started Flipping Furniture to Pay Off Debt — I Never Expected THIS to Happen to My Mental Health,I picked up furniture flipping as a side hustle to pay off debt fast… but what happened to my mental health along the way? Thanks ...,Lemons To Lemonade Home,2026-05-23T14:30:06Z,152000,"furniture flipping, How to Flip Furniture, painting furniture, interior design, Lemons To Lemonade Home, DIY furniture makeover, budget furniture makeover, Easy Furniture Makeover, modern makeovers, Lemons To Lemonade, How to Flip, Flip Furniture Lemons, facebook marketplace flip, upcycled furniture, furniture restoration, side hustle, DIY, chalk paint, furniture painting, how to make money, furniture repair, vintage furniture, how to flip furniture, home decor, flip, Thrift",184203,8252,464,276003
o2XS8AMFSVc,https://www.youtube.com/watch?v=o2XS8AMFSVc,UCufNgVwxqt3M9gDHBlD3usQ,restoration hacks,This Axe Won’t Fly Off Anymore ⚒️,"In this video, I test two different DIY methods for securing an axe head onto a wooden handle ⚒️ The first method uses a bolt ...",Craft Hacks Studio,2026-05-29T12:00:04Z,830,"axe repair, diy axe, woodworking, tool restoration, bolt and nut, nails and wire, survival tools, hand tools, workshop, homemade tools, satisfying, diy project, lifehack, shorts, viral shorts, reparacion de hacha, mango de hacha, bricolaje, herramientas, restauracion, tornillo y tuerca, alambre, clavos, carpinteria, taller, truco, satisfactorio, proyecto diy, viral, مقبض الفأس, اصنع بنفسك, ادوات, ترميم, برغي وصامولة, مسامير, اصلاح منزلي, ورشة, فيديو مرضي, شورتس, diy",266977,695,5,274027
R8mC01kJBTA,https://www.youtube.com/watch?v=R8mC01kJBTA,UCHVDJ3yUaFuEunlHDjj0HsQ,dresser makeover,I turned stress into a furniture business… and people think I’m “fake” 👀🔥 | Furniture Artist Story,"Do I refinish furniture inside my home? And why don't you always see my face in my videos? I get this a lot, and I've also had ...",Grace Holbrook | DIY + FLIPS,2026-04-13T20:30:52Z,199000,,154455,10769,190,265945
9ZDAYtIjvQI,https://www.youtube.com/watch?v=9ZDAYtIjvQI,UCd0p2PapyAM5cT6iHhaFU3w,restoration projects,You Won’t Believe This Castle Restoration,Watch an abandoned French neoclassical castle transform into a breathtaking luxury estate. This restoration journey brings a ...,Titan Projects,2026-03-18T00:15:47Z,2700,,221584,3228,241,258684
WDL-v6utDbI,https://www.youtube.com/watch?v=WDL-v6utDbI,UCY6hftKZiVjHkyepK8MXYaQ,restoration hacks,🔋Never throw them away! I keep using Copper pipe to RESTORE the same battery for 35 years 😲,Welcome to Totally Hacks – where we turn scrap into powerful tools and uncover hidden tricks most people never discover.,Totally Hacks,2026-03-21T12:26:30Z,34200,"TotallyHacks, DIY, DIY projects, DIY project, DIY ideas, Do it yourself, how to make, howto, DIY hacks, life hacks, tips and hacks, DIY invention, invention, creative ideas, smart ideas, home improvement, recycling, upcycling, reuse, restore an old car battery, diy battery, battery charging, lead acid battery restoration, fix it fast, restore car battery, how to fix dead car battery, strongest diesel battery, how to renew a battery, care battery revive",158993,9232,327,257853
rAO3sffHGQM,https://www.youtube.com/watch?v=rAO3sffHGQM,UCSLClJLzdUMRMe0E4SPfc-w,woodworking power tools projects,This NEW Woodworking Jig Is CHEATING (genius),Wood joinery can be hard for beginners. This new jig and router bit makes it easy! (click ...more to see links to tools) TOOL ...,731 Woodworks,2026-05-16T11:01:19Z,910000,"wood joinery, how to make a lock miter joint, easy lock miter joint, router table joinery, hidden wood joints, strongest wood joints, microjig fitfinder, microjig lock miter bit, router table setup, microjig, fitfinder tool, woodworking router bits, router table tips, 731 woodworks, woodworking, woodworking tips and tricks, woodworking tools, woodworking for beginners, woodshop projects, cabinet making joints",206014,4523,127,253784
