video_id,video_link,channel_id,query,title,description,channel,published_at,subscriber_count,tags,view_count,like_count,comment_count,engagement_score
4cbvwQx0eH4,https://www.youtube.com/watch?v=4cbvwQx0eH4,UCKiQre8JJEQ0kFdatGY5HlQ,oscillating multi tool uses,I Wasted Money on These Tools… Don’t Make This Mistake,"https://www.instagram.com/ http://www.whitelyonwoodworks.com Subscribe for real shop fixes, tips or projects. I've bought tools I ...",White Lyon Woodworks,2026-04-22T18:08:29Z,1120,"woodworking, woodworking tools, beginner woodworking, tool mistakes, woodworking tips, tool buying guide, woodworking shop, tool review, woodworking for beginners, shop tools, woodworking advice, diy woodworking, best woodworking tools, tool regrets, woodworking setup",16132,432,63,21712
ftr9QiKQQTY,https://www.youtube.com/watch?v=ftr9QiKQQTY,UCkc8i_uPePOHjB7HnBDWi8Q,construction power tool hacks,Roof Framing Connector Hack That Saves Time and Boosts Strength,Roof Framing Connector Hack That Saves Time and Boosts Strength Metal framing connectors lock roof members into position ...,NEXTGEN,2026-05-30T08:00:37Z,48600,"roof framing, framing connectors, joist hanger installation",21242,33,0,21572
j461VgtIE6U,https://www.youtube.com/watch?v=j461VgtIE6U,UCUA6sNe9a5JfUiOOQdBWMmA,furniture flip,Took me a year to refinish but it was worth the wait!,"This set had been sitting in my inventory for about a year, just waiting for the right vision—and this was it. This is a full American of ...",Olive Street Designs,2026-04-05T13:01:23Z,148000,"Vintage, Furniture, furniture flip, how to flip furniture, furniture flipping, diy",9819,981,75,21129
HA173fBpYPA,https://www.youtube.com/watch?v=HA173fBpYPA,UCDWG4wrQoEDd0mz08TwRZdw,rotary hammer drill uses,Powerful Wall Demolition with Rotary Hammer – Fast &amp; Efficient Removal!,Title Powerful Wall Demolition with Rotary Hammer – Fast & Efficient Removal! Tool Name Rotary Hammer Drill (Demolition ...,Innovative Mechanix,2026-03-23T07:00:11Z,76600,,20268,27,0,20538
yYFJfWw2_L4,https://www.youtube.com/watch?v=yYFJfWw2_L4,UC-p60OPSzeFHQ2ehRNwdwTg,dresser makeover,BOLD gold Art Deco furniture MAKEOVER,"our store: https://montfordboulevard.etsy.com In this video, we makeover a 1940s Art Deco vanity, that also has Art Nouveau ...",Art Deco Furniture,2026-03-15T14:10:04Z,16000,,9043,899,110,20233
lMVW7yWAros,https://www.youtube.com/watch?v=lMVW7yWAros,UCNu1HDxChB-eXbDzdeIT3_A,thrift flip,"Genius…Thrift flips, DIY home décor, upcycling ideas, budget‑friendly cozy home decor, I wanna sleep","Genius…Thrift flips, DIY home décor, upcycling ideas, budget‑friendly decorating, create a cozy home Thrift flips, easy DIY's, and ...",The Cautious Creative,2026-05-10T16:01:09Z,46000,"The cautious creative, Thrift flips, Thrift flip, DIY, Easy DIY’s, Budget friendly, Home decor, DIY home decor, Transforming thrifted finds, Upcycling, Upcycled, Upcycle ideas, Reuse, Creating a cozy home, Styling your home, Collected home, Thrifted home, Thrifting, Thrift with me",12533,690,28,19993
zpTeYyOcDUo,https://www.youtube.com/watch?v=zpTeYyOcDUo,UCt0rmobJfqir7XFb-FHAT2w,woodworking power tools projects,The Invisible Wood Knot Repair 👌 #diy #woodworking #shorts,"Tried repairing a knot using a square wood inlay on this woodworking project. The inlay is cut with a slight taper, so when it's ...",DIY European GUY,2026-05-30T06:21:05Z,6980,"#asmr, #diy, #shorts, woodworking, tips, hack, 5 minute craft, diy, shorts, woodworking tips, tips and tricks, satisfying, jigs, tool, woodworking tool, lifehacks, woodworkinghack, handyman, asmr, tipsandtricks, 5minutecrafts, woodworkingjigs, woodworkingtools, handwork, handsaw, wallnut, Purpleheart, blackwallnut, 5 minutes craft, diy projects, woodworkingtips, workshop, life hacks, tools, power tools, diy activities, diyprojects, do it yourself, handcraft, trick, drill, diy ideas",17995,196,1,19975
qV9h-4YOgPg,https://www.youtube.com/watch?v=qV9h-4YOgPg,UCTDoViMCg7c9QsB1iWWEVxA,carving project ideas,Satisfying garden project,This Easy Garden Idea Turns Dirt Into Beauty.,John Diy Kraft,2026-05-27T17:00:30Z,1400,,18283,152,1,19823
65hqpnkYguI,https://www.youtube.com/watch?v=65hqpnkYguI,UCEsw0ejHSksi7aUpW9eZucg,cabinet makeover,Making Over the Smallest Bedroom in Our House (Thrifted + DIY Makeover),Thank you to Quince for sponsoring this video! Elevate your essentials with Quince. Go to https://quince.yt.link/JlgGeVK for free ...,Janda Shamess,2026-05-28T22:57:55Z,13500,,11013,716,78,19733
1UhTAadPUFk,https://www.youtube.com/watch?v=1UhTAadPUFk,UCAKRwgy0KyZwoIQ-8TvTJKg,woodworking power tools projects,Wood Ideas for Better Results #diy #woodworking #tricks,"Wood ideas for better results featuring smart woodworking techniques and DIY tips to improve cutting, joining, and finishing for ...",Beamish,2026-05-31T02:00:23Z,2290000,"easy, wood, crafts",16672,297,1,19662
zFHTKgIOMv0,https://www.youtube.com/watch?v=zFHTKgIOMv0,UC60-IeHN7_TTxivBzJBjgPQ,dresser makeover,How I updated a $20 Thrifted French Provincial Dresser with a Modern and Sophisticated Finish,I transformed a $20 thrifted French Provincial dresser from dirty and dated to modern and sophisticated. With deep navy mineral ...,Salvaged Inspirations,2026-03-03T07:04:57Z,58300,,10644,817,34,19494
YRd4cgfhn2w,https://www.youtube.com/watch?v=YRd4cgfhn2w,UC4Xarmlw0RJ573ZgJO2b5GA,impact driver uses,You’ve Been Using Your Drill Wrong Your Whole Life,"Stop stripping screws and burning bits. This woodworking guide explains the drill clutch, speed settings, and when to use an ...",Spencley Design Co.,2026-03-21T13:22:45Z,242000,"eric spencley, spencley design, spencley design co, spencely, woodworking",12555,585,34,19085
p-x_4T_obYQ,https://www.youtube.com/watch?v=p-x_4T_obYQ,UC3KQkki9G4jU3wg_74ZBieA,restoration hacks,How a Mini Differential Gearbox Actually Works! ⚙️ #MechanicalEngineering #DifferentialGearbox,"Ever wondered how mechanical power splits and changes direction? In this video, we take a look inside a precision-engineered ...",Build & Hack Pro,2026-05-30T19:00:21Z,15000,"differential gearbox⁠, ⁠bevel gear assembly⁠, ⁠miniature gearbox⁠, ⁠T-box gearbox⁠, ⁠mechanical engineering⁠, ⁠how a differential works⁠, ⁠satisfying engineering⁠, ⁠RC car differential⁠, ⁠micro mechanics⁠, ⁠gear assembly⁠, ⁠powertrain⁠, ⁠machining and assembly⁠, ⁠3-way gearbox⁠",18294,48,0,18774
VWJi1jG3DJs,https://www.youtube.com/watch?v=VWJi1jG3DJs,UC0NBDEd4nECrlJnUEaJisEQ,rotary hammer drill uses,"Rotary Hammer Drill with a SDS chuck, How it works and what SDS means. ##diy","In this vidoe I explain how a rotary Hammer Drill works, what SDS means and why we use it. #diy #diytools #maker #tradesman ...",John McGrath (Man In Shed),2026-05-21T18:09:51Z,124000,,13534,487,16,18724
y0YMHoGfZ80,https://www.youtube.com/watch?v=y0YMHoGfZ80,UCu1mYVdOakCpunJSZNvt_0Q,power tools latest use cases,"NEW Power Tools from Milwaukee, Dewalt, Kreg, Makita, Wera, Knipex , and more!","NEW Power Tools from Milwaukee, Dewalt, Kreg, Makita, Wera, Knipex , and more! In this video, we explore the newest power ...",Tools Zone,2026-04-26T13:30:00Z,55300,"new power tools, power tools, new tools announced, power tools news, new tools news, upcoming tools, new power tools announced, new tools, new makita tools, new milwaukee tools, power tool news, new dewalt tools, new ryobi tools, milwaukee, makita, milwaukee power tools, makita circular saw, new power tools 2025, new milwaukee hand tools, makita tools, milwaukee packout, wiha tools, wera tools, new wera tools, wera, wiha, knipex, wera screwdrive, germany hand tools, festool",16987,149,2,18517
8tXrqaOs9n8,https://www.youtube.com/watch?v=8tXrqaOs9n8,UCTFL2Qji9jNJwh3G_HU_4Vg,carving project ideas,Perfect Wood Joint,"Welcome to our woodworking channel where creativity meets craftsmanship. We share smart woodworking ideas, useful DIY ...",Zinwork,2026-05-28T06:00:28Z,1200,"woodworking, carpentry, wood joint, wood joinery, hand tools, diy woodworking, woodworking ideas, woodworker, satisfying",18033,7,0,18103
AVrRzTRUGPg,https://www.youtube.com/watch?v=AVrRzTRUGPg,UCy6EyOOm_3LN40oDIbk9Eqg,DIY power tools trends,HIS FACE!!! Best surprise he never saw coming,Links: Instagram: www.instagram.com/thedailynelly TikTok: www.tiktok.com/janelleandkate #janelle #thedailynelly ...,The Daily Nelly,2026-05-30T15:00:25Z,2180000,"janelle, janelle flom, funny, comedy, pranks, hacks, lifehacks, diy, diyhacks, viral trends, viral videos",13617,419,7,17947
mPO2Jc2wzDU,https://www.youtube.com/watch?v=mPO2Jc2wzDU,UCGAUHfGEpQ3ZKyxGfcF2kZA,cordless drill projects,How custom friction wheel attachments optimize ancestral spirit money burning #drill #machinery,"1. Project Overview This operation demonstrates a highly unique and inventive modification of a traditional cultural practice, ...",Engineered World Beta,2026-05-30T21:00:11Z,17000,"#Engineering, #HowItWorks, #Machinery, #Technology, #Education, #Industry, #AgriTech, #Automation, #Manufacturing",17385,0,1,17405
e8QW4RvVTGk,https://www.youtube.com/watch?v=e8QW4RvVTGk,UC1QUlf7bBCRgrsMeOZ4nILA,thrift flip,Thrift. Flip. Repeat. Spring 2026 Trends You Can DIY at Home 🌸,"Thrift, flip, repeat! Spring 2026 is all about making trends your own—without the designer price tag. In this video, I'll show you ...",Canterbury Cottage,2026-05-29T21:00:40Z,325000,"DIY, DIYs, Thrift flip, Home decor, Budget decorating, Canterbury Cottage, Upcycle, Repurpose, Furniture Flip, Resale, Look for less, Trash to Treasure, thrift flip, diy home decor, trend alert, makeover ideas, upcycle style, vintage to modern, creative diy, affordable decor, seasonal refresh, secondhand chic, flip challenge, decor transformation, thrift shopping, budget makeover, home styling, crafty trends, reuse recycle, design on a dime, diy crafts, thrift haul",12176,485,13,17286
aDgpV26rLW0,https://www.youtube.com/watch?v=aDgpV26rLW0,UCNu1HDxChB-eXbDzdeIT3_A,thrift flip,DIY Thrift Flips &amp; Upcycling Ideas | Cozy Vintage Home Decor Transformations | budget friendly reuse,DIY Thrift Flips & Upcycling Ideas | Cozy Vintage Home Decor Transformations | budget friendly reuse Come thrift with me for a ...,The Cautious Creative,2026-04-25T16:00:01Z,46000,"The cautious creative, Thrift flips, Upcycling ideas, Cozy home decor, Vintage home styling, DIY, DIY thrift flips, DIY home decor, Thrifted transformations, Budget friendly decor, Cottage core decor, DIY vintage decor, Thrifted vs styled, Easy DIY’s, Transforming thrifted finds",9607,579,46,16317
2ctKgErjhjg,https://www.youtube.com/watch?v=2ctKgErjhjg,UCJc8ztNoh1xnzqMK5yXXhLQ,woodworking power tools projects,Slide Door Auto Lock - Premium Build #shorts #woodworking #diy,Title Slide Door Auto Lock - Premium Build #shorts #woodworking #diy Description Watch as we transform a simple block into a ...,Creator Anubhav Sharma,2026-05-30T13:25:55Z,54800,"new technology, information technology, creative cloud, virtual reality, artificial intelligence, technology, woodworking, woodworking projects, wood projects, wood working, wood planer, wood crafts, diy wood projects, diy projects, diy crafts, easy crafts, craft ideas, diy, wood, asmr, how to make, AI, ar, vr, do it yourself, 3D, 3D modeling, new technology 2026, gate, tools, craft, sliding door latch, how to, art, handmade, woodcraft, Slide Door Auto Lock, life hacks, satisfying",15381,61,0,15991
nyKzTFQL5Z0,https://www.youtube.com/watch?v=nyKzTFQL5Z0,UC6IqCusOHOC1U8G_AdmVMSw,dresser makeover,This Bombe Dresser Transformation Is Pure Romance,Bozena @bozenkaart created the dreamiest furniture transformation using our Blush Harmony Decor Transfer paired beautifully ...,Redesign with Prima,2026-05-23T13:00:55Z,161000,"furniture makeover, blush harmony decor transfer, bloom and flutter decor mould, redesign with prima, bombe dresser makeover, diy furniture makeover, floral furniture makeover, vintage chic decor, romantic furniture style, painted furniture ideas, elegant furniture makeover, decor mould ideas, shabby chic furniture, furniture flip ideas, artistic furniture makeover",10443,533,9,15953
A206gWSmGCw,https://www.youtube.com/watch?v=A206gWSmGCw,UCEoVtgdad01L0_UazC9YXEw,DIY power tools trends,This Simple Invention Could Change Everything! Amazing DIY Tool You Can Make at Home,This Simple Invention Could Change Everything! Amazing DIY Tool You Can Make at Home Thanks for Watching Brilliant ...,Master Q,2026-05-30T13:00:23Z,255000,"master q, how to weld metal for beginners, how to welding for beginners, asmr, diy idea, learn welding, diy, Welding, do it yourself, how to, tips, Ideas, hack, weld, how to make, Homemade DIY Tool, The Secret Of The Tool, welder, Invention, DIY TOOL, Tools, DIY tool at home, Mechanical Tools, This Simple Invention Could Change Everything! Amazing DIY Tool You Can Make at Home, diy welding, diy weld, welding tips, welding, sprocket, chainring, Sprockets and chains, pulley, homemade pulley",14546,105,8,15756
Z127sOKdOKc,https://www.youtube.com/watch?v=Z127sOKdOKc,UCP93XSbEvfIyNcq6L3Z1QPQ,carving project ideas,Awesome WOODWORKING Projects You Need to See Now #tooltips #woodworking,Dear All Fan Welcome to Woodworking Tools TV! Discover the most impressive and creative woodworking projects that will ...,Woodworking Tools TV,2026-05-29T13:10:23Z,1020000,"Woodworking Tools TV, woodworking projects, saw, woodworking bench, DIY, home improvement, woodcraft, amazing, power tools, woodworking, woodworking ideas, table, DIY furniture, woodworking plans, woodworking for beginners, DIY tools, furniture making, carpentry, tips and tricks, woodworking hacks, woodworking tips, DIY projects, diy, tips and hacks, diy tools, crafting, diy furniture, tools, wood, building, wood shop, tool hacks, woodworking techniques",13044,258,6,15744
FBOWnz_W3sE,https://www.youtube.com/watch?v=FBOWnz_W3sE,UCgmfnKIsxxpCgn1xCrW3f7A,carving project ideas,Perfect Wood Joint,"Welcome to our woodworking channel where creativity meets craftsmanship. We share smart woodworking ideas, useful DIY ...",Worksite Reality,2026-05-29T06:00:29Z,8950,"wood joint, woodworking, precision carpentry, handmade furniture, wood craftsmanship, satisfying woodworking",15002,57,0,15572
fpPZgq5EIhI,https://www.youtube.com/watch?v=fpPZgq5EIhI,UCcZnDP3HjMdoDurPhGOYLwA,rotary hammer drill uses,Milwaukee M18 FUEL SDS: Is any OTHER brand reaching this power?,"Red, Yellow, or Teal? Watch this M18 FUEL 1-1/8” Rotary Hammer effortlessly drop a structural anchor into solid concrete.",BuiltRightco,2026-05-21T03:32:57Z,14800,"Milwaukee Vs DeWalt, Milwaukee m18 fuel, makita vs Milwaukee, best rotary hammer, tool brand wars, cordless power tools, Milwaukee m18 fuel SDS, sds-plus hammer drill, concrete drilling speed, professional grade tools, jobsite battery platform, tool review comparison, red vs yellow tools, Milwaukee high output, heavy duty fastening, Contractor tool preference",14506,77,14,15556
Z8NBe3XIhO0,https://www.youtube.com/watch?v=Z8NBe3XIhO0,UCjaWY3w6Buo0eq7NdXKsroQ,impact driver uses,Cordless Impact Driver | Fast Wood Joint Screw Installation.,TITLE: Cordless Impact Driver | Fast Wood Joint Screw Installation DESCRIPTION / NARRATION: tunggu jangan skip dulu guys.,LifeFrame Studio,2026-03-08T14:00:58Z,90400,,15169,32,0,15489
MHG82sIk_6s,https://www.youtube.com/watch?v=MHG82sIk_6s,UCjaWY3w6Buo0eq7NdXKsroQ,impact driver uses,Rusty Wheel Bolt Removal – Power of Impact Wrench!.,"Title Rusty Wheel Bolt Removal – Power of Impact Wrench! *Description/Narration tunggu jangan skip dulu guys! In this video, we ...",LifeFrame Studio,2026-03-30T11:00:00Z,90400,,15061,6,0,15121
XGbxV0cwPi8,https://www.youtube.com/watch?v=XGbxV0cwPi8,UCbG4ekOHTex7f3_PZR4_HTg,power tools latest use cases,"RIDGID NUKE 18V SubCompact Brushless Tools - Drills, Impacts, &amp; Saw","Not to be confused with explosions, new RIDGID NUKE tools are 18V SubCompact Brushless tools that are up on performance ...",Shop Tool Reviews,2026-05-23T02:40:59Z,205000,"shop tool reviews, best tools, best mechanic tools, how to, diy, home depot, lowes, milwaukee tool, dewalt tools, snap-on tools, power tools, how to use tools, ridgid power tools, ridgid nuke 18v, ridgid nuke sub compact tools, best ridgid tools, ridgid 18v tools",10258,375,54,15088
oM0gqcjQXJQ,https://www.youtube.com/watch?v=oM0gqcjQXJQ,UCcyMuaNn9iQNYTZG54TwbGg,rotary hammer drill uses,Insane Concrete Breaking Hack with Rotary Hammer 👷 Satisfying Demolition!,Title: Insane Concrete Breaking Hack with Rotary Hammer Satisfying Demolition! Tool Name: Rotary Hammer Drill (Demolition ...,PUZZLES WORKERS,2026-04-17T12:59:01Z,16300,,14762,17,0,14932
DA-9yNFj82A,https://www.youtube.com/watch?v=DA-9yNFj82A,UC2ThgZYFqqj_Ksg77Hul4GA,tool restoration,⚙️ Sharpening Metal Clipper Blades with a Rotary Disc Sharpener,A step-by-step demonstration of the technical process behind sharpening metal clipper blades. See how the blades are held ...,CRAFTS SHOW,2026-05-30T12:30:23Z,447000,,14585,27,0,14855
bjkIi2PJ1I8,https://www.youtube.com/watch?v=bjkIi2PJ1I8,UCOJG0fpprB_5HNBplFkTq2Q,furniture flip,I Found These Trashed for $40... Then I Sold Them for $300! 💰,"I almost walked past these at Goodwill. A matching pair of Ethan Allen side tables for $40 total — in incredible condition, just ...",thefliphut,2026-05-04T16:41:32Z,57100,,8899,459,54,14569
nux1Z-JdNbw,https://www.youtube.com/watch?v=nux1Z-JdNbw,UCL0-dAhREXWdGfQIhTbz12Q,construction power tool hacks,TOO SKILLED TO BE REAL 😱 | Part 11 #shorts #skills #workers #satisfying #factory#tricks,The most satisfying worker skills ever caught on camera Too skilled to be real.Part 9 #shorts #skills #workers #satisfying ...,    Smart Tricks,2026-05-27T10:59:56Z,555,,12286,159,0,13876
rTU1KwYIPak,https://www.youtube.com/watch?v=rTU1KwYIPak,UCQlJ8a4PlxpO6qKNm2yeq7g,thrift flip,upcycling clothes into a early 2000s closet | thrift flip,"In need of new clothes and saving money, thrift flipping & upcycling clothes not only solves that but unlocks a new hobby/skill.",francinebam,2026-05-20T14:01:13Z,364,,8056,491,20,13366
Uauol80k_s0,https://www.youtube.com/watch?v=Uauol80k_s0,UC4lRW9cqbKA2Zg2xIjqoifQ,tool restoration,Restoring a rusty knife left outside over winter #restoration,,Sacco Knives,2026-05-29T02:58:53Z,4070,,6977,579,21,13187
0Rxk8DgVl_g,https://www.youtube.com/watch?v=0Rxk8DgVl_g,UC-p60OPSzeFHQ2ehRNwdwTg,furniture restoration,A trash to CASH Art Deco furniture story,"our store: https://montfordboulevard.etsy.com email: montfordboulevard@gmail.com In this video, we restore and makeover ...",Art Deco Furniture,2026-05-29T20:45:06Z,16000,"DIY furniture restoration, Art Deco furniture, how to make money flipping furniture",4397,687,90,13067
xiYYCkQO13g,https://www.youtube.com/watch?v=xiYYCkQO13g,UC5fs7PookxGfDPTo-RU0ReQ,power tools latest use cases,15 AI Tools Every Student &amp; Professional Must Use in 2026,SPECIAL OFFER for my viewers: Try Dokkio FREE for 1 month! Visit: https://dokkio.com/pavan Use Referral Code: pavan ...,Pavan Lalwani,2026-05-28T15:00:03Z,319000,"canva video, canva ai tutorial, how to use canva, canva ai tools, canva design, canva course, canva ai video generator, tutorial canva, canva animation, learn canva, design with canva, canva pro free, canva full course, digital products, canva video editing tutorial, ai video creation, canva design tutorial, canva tutorial for beginners, canva ai image generator, claude ai, canva ai video, ai, canva ai generator, how to use canva ai, free canva pro, canva tips",8158,431,17,12808
zELnY8oY33k,https://www.youtube.com/watch?v=zELnY8oY33k,UC3KQkki9G4jU3wg_74ZBieA,woodworking power tools projects,Satisfying Texture Wood Carving | Power Tool Texturing Technique #WoodCarving #Woodworking,Watch this incredibly satisfying process of creating uniform textures on a wood surface using a specialized rotary power carving ...,Build & Hack Pro,2026-05-29T13:00:16Z,15000,"wood texturing tool, rotary carving attachment, power wood carving, satisfying woodworking, adding texture to wood, wood grain patterns, custom furniture design, creative wood art, mechanical wood carving, workshop craft projects",12479,25,0,12729
wW90y-IAwgU,https://www.youtube.com/watch?v=wW90y-IAwgU,UCAbYSztxaC95-W7fpNI2qxg,construction power tool hacks,Next-level satisfying worker skills ✅.. #construction #workers #satisfying,"Most workers never learn these simple construction tricks… In this video, you'll discover smart and practical work hacks that can ...",Super Build Engineer,2026-05-30T14:06:44Z,86200,,8888,336,0,12248
Ggb8OwHujbY,https://www.youtube.com/watch?v=Ggb8OwHujbY,UCMwxcKBkxVUu4IRMvcHli8Q,DIY power tools trends,20 Genius New Tools Every Pro &amp; DIYer Needs in 2026,"Discover the most innovative tools of 2026! From robotic construction assistants to genius woodworking gadgets, this list covers ...",Top Tech Tools,2026-03-19T18:26:12Z,302000,"best tools 2026, new construction tools, woodworking gadgets, innovative tools, smart tools, carpentry tools, DIY gear, Makita 2026, Milwaukee new tools, hand tools, Knipex pipe cutter, Craftsman tools, Metabo cordless, top tech tools, tool review, construction equipment, electrician tools, plumbing tools, home improvement, workshop upgrades, new tools 2026, best tools for men, genius tools, construction tools, woodworking tools, diy gadgets, makita dcu601, milwaukee",11168,103,1,12218
k0dZRFv2G80,https://www.youtube.com/watch?v=k0dZRFv2G80,UCwnVCTjOeY03fafdIr_d4Jw,tool restoration,Restoring a Rusty Hammer: Unbelievable Transformation! ,"I found this old, crusty, and completely unusable rusty hammer... and I couldn't leave it like that. You won't believe the level of ...",Relax Restoration,2026-05-27T16:38:04Z,4490,"Restoration, Rusty Hammer, Hammer Restoration, Rusty Tool Restoration, Satisfying Video, ASMR Restoration, DIY, How to Fix Rust, Metal Restoration, Tool Restoration, Amazing Transformation, Before and After, Rust Removal, Cleaning Rusty Tools, Satisfying Restoration, Rusty to Shiny, DIY Projects, Tool Repair, Extreme Restoration, Incredible Transformation, Hand Tool Restoration, Metal Cleaning, Rust Removal Process, Satisfying ASMR, Cleaning Tools, Old Tool Restoration",9731,224,9,12151
p3myb_QQCBQ,https://www.youtube.com/watch?v=p3myb_QQCBQ,UCxNm1pCB26g9EBJCGSoa9lw,rotary hammer drill uses,Watch This Concrete Finishing Hack Save Hours of Labor! #Construction,"TITLE (USA HOOK) Watch This Concrete Finishing Hack Save Hours of Labor! #Construction DESCRIPTION In this video, ...",Syafil Workers,2026-05-30T22:36:32Z,4390,"concrete finishing hack,
concrete leveling trick,
construction productivity,
concrete tools",11811,22,0,12031
X_RbxpASiMw,https://www.youtube.com/watch?v=X_RbxpASiMw,UC6caY-oKWtKx8yD6eqx45gA,thrift flip,Cottage Rustic Thrift Flips For Cozy Home Decor on a Budget,"f you love cozy, vintage-inspired decor with a rustic cottage feel, you're going to love today's thrift flips! In this video, I'm ...",Making It My Own Creations,2026-04-07T23:00:00Z,103000,"cottage style decor, cottage diy, thrift flip ideas, thrift store makeover, rustic home decor, vintage inspired decor, budget home decor, thrifted decor ideas, cottage aesthetic diy, cozy home decor ideas, farmhouse cottage decor, rustic diy projects, upcycle home decor, diy home decorating ideas, thrift flip compilation, cottagecore decor diy, vintage cottage crafts, making it my own creations, diy rustic decor, grandmacore, thrift flip decor diy, home decorating ideas 2026",5612,514,59,11932
gRj1kQiGh48,https://www.youtube.com/watch?v=gRj1kQiGh48,UCMwxcKBkxVUu4IRMvcHli8Q,power tools latest use cases,20 BRAND NEW Tools That Are Absolute Game Changers!,"Looking for the coolest new tools on the market? Today, we are breaking down 20 brand-new power tools, hand tools, and ...",Top Tech Tools,2026-05-20T20:02:51Z,302000,"coolest tools, 20 brand new tools, game changing tools, new power tools, tool haul, tool review, best tools 2026, construction tools, woodworking tools, carpentry tools, DIY tools, hand tools, mechanics tools, milwaukee tools, dewalt tools, makita tools, ryobi 18v, kreg tools, stiletto hammer, klein tools, sealey tools, job site tech, gadgets for men, ingenious tools, tool innovation, tool bag upgrade, new milwaukee tools, new dewalt tools, must have tools",10909,77,0,11679
i9eR_jlI4-I,https://www.youtube.com/watch?v=i9eR_jlI4-I,UCUZM_1AiYQiObBwBMYPO3yA,furniture flip,This Nightstand Flip Made Me $400 In One Afternoon #furniture #diy,"You can refinish this nightstand in 1 day! It took me 4h hands on to finish this vintage restoration, and I love the results! This video ...",Casa Amor Furniture - by Camila Johnson,2026-04-11T01:02:09Z,3220,"antique, restoration videos, antique restoration, woodworking, how to, diy, restoring, vintage, diy furniture restoration, home decor, asmr restoration, mid century furniture, furniture, how to flip furniture, furniture makeover, how to restore furniture, restoration project, satisfying restoration, diy restoration, diy home decor, wood, nightstand, restoration, vintage furniture, wood restoration",7249,376,27,11549
fdeq8cjJ-zI,https://www.youtube.com/watch?v=fdeq8cjJ-zI,UCEDeA6O62wLEFnqBDEofwPQ,impact driver uses,Impact DRIVER or Impact WRENCH?,"Do you really need to drop $200+ on a dedicated impact wrench, or can your impact driver handle the heat? 🛠️ In today's video ...",Drew Does Tools,2026-04-17T17:54:44Z,14500,,8627,208,41,11527
