video_id,video_link,channel_id,query,title,description,channel,published_at,subscriber_count,tags,view_count,like_count,comment_count,engagement_score
05CXC0uQG7g,https://www.youtube.com/watch?v=05CXC0uQG7g,UC_AH34G_3mHPYatykfM8pkQ,angle grinder projects,Amazing DIY Metal Holder for Angle Grinder | Genius Workshop Innovation,TITLE: Amazing DIY Metal Holder for Angle Grinder | Genius Workshop Innovation TOOL NAME: DIY Grinder Metal Holder ..., SmartTools,2026-05-20T14:00:00Z,20500,,79065,172,0,80785
-95zWjd_1nw,https://www.youtube.com/watch?v=-95zWjd_1nw,UCgViBKhOxI3T2SPu2pUlucA,dresser makeover,RESTORING a RARE Old Map Cabinet for my Workroom Makeover,"My workroom had one big issue; and I've finally solved it! Plus, this AMAZING little antique cabinet is rustic perfection for storage.",Transcend Furniture Gallery,2026-03-29T14:58:18Z,298000,"furniture, furniture flipping, painted furniture, furniture painting, diy, diy furniture, repurposed, refinished furniture",27037,4438,431,80037
I7JlaMq8Shw,https://www.youtube.com/watch?v=I7JlaMq8Shw,UCCRhU9CwWCR1I4K0vTmZ4bw,tool restoration,Restored My Grandma&#39;s Old Rusty Sugar Grinder #restoration #satisfying #asmr #rustremoval,"Watch this satisfying restoration transformation as I bring an old rusty item back to life. From heavy rust removal to deep cleaning, ...",Rust Bench,2026-05-26T15:00:20Z,3320,"restoration, satisfying restoration, rust removal, tool restoration, antique restoration, metal restoration, restoring old tools, vintage restoration, oddly satisfying, restoration videos, before and after restoration, restoration ASMR, DIY restoration, workshop restoration, rusty tools restoration, deep cleaning, satisfying videos, tool repair, restoring rusty items, metal polishing, cleaning rust, restoration project, old tool restoration, extreme restoration, shorts",64819,1387,12,78929
BHcMxWFIM4E,https://www.youtube.com/watch?v=BHcMxWFIM4E,UCrVkr_nIIxAeucYdZK8gtxw,furniture flip,GENIUS Furniture Flips You NEED to Try!,GENIUS Furniture Flips You NEED to Try! These budget-friendly transformations will make your home look effortlessly elevated.,Designed to the Nines,2026-04-02T21:31:21Z,460000,"designed to the nines, design to the nines, natalee callahan, lone fox, xo macenna, how to, diy, decor, diy decor, home decor, kristen mcgowan, do it on a dime, furniture makeover, furniture restoration, furniture flip, reupholstering a chair, reupholstery, recovering chairs, ottoman, thrift flip home decor, thrifted home decor, thrift flip decor, diy wife, home decor diy, how to flip furniture",36525,3915,152,78715
NPMpXA0VBxM,https://www.youtube.com/watch?v=NPMpXA0VBxM,UC5u803Jv60OMquJMtwUyoGg,furniture flip,I Sold This Thrifted Dresser for HOW MUCH? 💰 | Dresser Flip Makeover | Lemons To Lemonade Home,I Sold This Thrifted Dresser | Dresser Flip Makeover | Lemons To Lemonade Home Thanks to SURI for partnering with me!,Lemons To Lemonade Home,2026-04-25T14:30:06Z,152000,"side hustle, diy furniture flip, furniture makeover, home decor, flipping furniture on facebook marketplace, thrift flip furniture, flipping furniture, furniture makeover diy, Lemons To Lemonade, Thrifted Dresser, Lemonade, facebook marketplace furniture, DIY, dresser design, MCM, luxury home decor, wood furniture, interior designer, dresser flip makeover, furniture restoration, furniture flipping, Trash to Treasure, how to flip furniture, How to, flip, lemons to lemonade home",43550,2602,418,77930
x4_jLuyzxg4,https://www.youtube.com/watch?v=x4_jLuyzxg4,UCa68zpY9C3IbERhv3Pbjg9g,furniture flip,I Broke My Own Rule on This Flip!,"In this video, we're flipping my favorite style of furniture to flip but this time with a twist! Thanks to Durham's Rock Hard Water Putty ...",Furniture Flipping Teacher,2026-04-10T00:01:06Z,351000,"furniture flipping for profit, furniture flip, diy furniture flip, side hustle, furniture flipping tips, furniture makeover, furniture painting, furniture flipping ideas, furniture flipping before and after, flipping furniture for beginners, furniture flipping teacher, durhams rock hard putty",35307,3741,246,77637
D6wHhlqyYUo,https://www.youtube.com/watch?v=D6wHhlqyYUo,UCu5G0D0kUxP752T6PtKAgiQ,woodworking power tools projects,Making Repeatable Tapered Stool Legs with a Router Jig on the Lathe,"How I turn perfect tapered stool legs every time Using a simple router jig on the lathe to get consistent, clean tapers quickly and ...",SawnOakLeaf,2026-05-27T16:12:26Z,17100,,72141,460,10,76941
3kkGqtJgsdA,https://www.youtube.com/watch?v=3kkGqtJgsdA,UCa68zpY9C3IbERhv3Pbjg9g,furniture flip,Turning This Room Into My Dream Office,Thanks to Rockler for sponsoring this video! Want to learn how to flip furniture for profit? Click here for more info on getting started!,Furniture Flipping Teacher,2026-05-29T00:00:04Z,351000,"furniture flipping for profit, furniture flip, diy furniture flip, side hustle, furniture flipping tips, furniture makeover, furniture painting, furniture flipping ideas, furniture flipping before and after, flipping furniture for beginners, furniture flipping teacher",31896,4097,151,75886
bKtfbNNcZXY,https://www.youtube.com/watch?v=bKtfbNNcZXY,UCa68zpY9C3IbERhv3Pbjg9g,furniture flip,This Coffee Table Was WRECKED… Look at It Now,In this video I am taking a $13 coffee table and transforming it into a modern masterpiece! Grab your DESLOCK120 Smart Lock ...,Furniture Flipping Teacher,2026-03-20T00:00:55Z,351000,"furniture flipping for profit, furniture flip, diy furniture flip, side hustle, furniture flipping tips, furniture makeover, furniture painting, furniture flipping ideas, furniture flipping before and after, flipping furniture for beginners, furniture flipping teacher",33775,3691,111,72905
69dMwWV_XeM,https://www.youtube.com/watch?v=69dMwWV_XeM,UC5u803Jv60OMquJMtwUyoGg,furniture flip,4 Things To Make Budget Furniture Look Designer | Luxury for Less | Lemons To Lemonade Home,4 Things To Make Budget Furniture Look Designer | Luxury for | Lemons To Lemonade ===== Check out EBL 1000w Power ...,Lemons To Lemonade Home,2026-03-21T14:30:06Z,152000,"furniture makeover, painting furniture, furniture painting, luxury home decor, Lemons To Lemonade Home, 4 Things To Make Budget, Furniture Look Designer, DIY furniture, Look Expensive, furniture transformation, side hustle, Lemons To Lemonade, facebook marketplace, lemons to lemonade furniture, furniture flipping, DIY, furniture flipping for profit, lemons lemonade, thrift flipping, home decor, luxury decor, room makeover, interior design, hutch makeover, mid century, mcm",43147,2200,106,67267
N2JToX3pniY,https://www.youtube.com/watch?v=N2JToX3pniY,UC6IqCusOHOC1U8G_AdmVMSw,cabinet makeover,IKEA Hack ✨ Moody Glam Cabinet Makeover Using Redesign!,From basic to moody glam ✨   Ilse @stylishinterior transformed this IKEA cabinet into a richly detailed statement piece using ...,Redesign with Prima,2026-04-24T13:28:54Z,161000,"IKEA hack furniture, cabinet makeover, furniture makeover, DIY furniture flip, Redesign With Prima, decoupage fiber tutorial, Avian Dreamscape decoupage, decor poly tutorial, furniture embellishment ideas, gold leaf furniture, stenciling furniture techniques, DIY home decor ideas",55851,924,31,65711
EFa6ArhWxuM,https://www.youtube.com/watch?v=EFa6ArhWxuM,UChSFytO6zQHxcawEaCKxryg,furniture restoration,Re-veneering a Vintage Morris Lounge Chair,This week in the shop Trena repairs and refinishes a vintage Morris-style lounge chair. William Morris designed the predecessor ...,John's Furniture Repair,2026-04-26T17:00:37Z,86500,"trena, john's furniture repair, thomas johnson, antique restoration, furniture, shop, workshop, tools, stripping, spraying, sanding, woodworking, mohawk, walnut stain, table, festool, tiktok, at restoration, dewalt, bleach, this old house, beard meets food, kardashians",23397,3558,181,62597
vbAzVZ7ViHM,https://www.youtube.com/watch?v=vbAzVZ7ViHM,UCgnnC7tKC5b52b9c79Gpc_w,thrift flip,Thrift Flip Bedsheets Into Home Decor That Looks Expensive,"In today's video, I'm taking some questionable items from the ""thrift shop"" and giving them a new life with some creative ""diy crafts""!",Life Style of a DIYER,2026-04-12T00:00:56Z,12200,"thrift flip, diy home decor, diy, thrifting, thrift decor, diy decor, trash to treasure, craft room, thrift shop, diy crafts, sewing for beginners, thrift store finds, home diy",40595,1877,133,62025
ha__KZ9VYD8,https://www.youtube.com/watch?v=ha__KZ9VYD8,UCBbs8-lk82CoHE6bDUi7vOg,impact driver uses,"Can we use Impact wrench for drilling,......#tools #impactdrill #impactwrench #tips #trick",,Crafter Bhaiya,2026-04-22T06:00:36Z,39200,"impact wrench as a drill, impact drill, impact wrench, tools, tool tips, diy",38511,2276,30,61871
-t-I4pDI1Jc,https://www.youtube.com/watch?v=-t-I4pDI1Jc,UCFYqjhnEeoYgnoHFPn9VUNQ,rotary hammer drill uses,Inside a Rotary Hammer Drill 🔨,"In this video, the internal components of a rotary hammer drill are shown while the tool is operating. Unlike a standard drill, this ...",Dead Scrollers Society,2026-04-14T04:16:20Z,3460,,54245,252,0,56765
hSlLIx4M5gA,https://www.youtube.com/watch?v=hSlLIx4M5gA,UCa68zpY9C3IbERhv3Pbjg9g,furniture flip,$20 Furniture Flip Anyone Can Do!,In this video I show you a quick flip that can earn fast cash in just 1 weekend! Want to learn how to flip furniture for profit?,Furniture Flipping Teacher,2026-03-13T00:01:01Z,351000,"furniture flipping for profit, furniture flip, diy furniture flip, side hustle, furniture flipping tips, furniture makeover, furniture painting, furniture flipping ideas, furniture flipping before and after, flipping furniture for beginners, furniture flipping teacher",25914,2900,87,56654
uTWx6Y17Z8w,https://www.youtube.com/watch?v=uTWx6Y17Z8w,UCMwxcKBkxVUu4IRMvcHli8Q,DIY power tools trends,20 Genius New Tools Every Pro &amp; DIYer Needs in 2026,"Upgrade your workshop in 2026! Today on Top Tech Tools, we are testing 20 of the most genius new woodworking innovations ...",Top Tech Tools,2026-03-05T15:30:48Z,302000,"woodworking tools 2026, new woodworking tools, genius woodworking tools, DIY woodworking, Top Tech Tools, workshop upgrades, woodworking tips, best woodworking gadgets, custom cabinet building, woodworking tool innovations, Festool tools 2026, Woodpeckers tools, Kreg jigs, woodworking hacks, tool review 2026, time saving woodworking tools, advanced woodworking gear",51836,437,9,56386
M_hH0D7s0X8,https://www.youtube.com/watch?v=M_hH0D7s0X8,UCcPuAb6RtYsoJYdZyc4jrVQ,power tools latest use cases,10 NEW Power Tools and Tech we found at IBS!,"Download Temu App now https://app.temu.com/k/pfgd96e7tst, and search my code【kcp8822】to claim a $100 Coupon Bundle ...",Tool Show,2026-03-07T15:02:19Z,257000,"power tool news, new power tools, new milwaukee tools, new makita tools, new dewalt tools, new bosch tools, new flex tools, new ryobi tools, new hart tools, new ego tools",39907,1315,77,54597
MJ1kOG3brII,https://www.youtube.com/watch?v=MJ1kOG3brII,UClV2AcY87S2zXnffSc7KLog,tool restoration,“Nobody Could Guess This 100+ Year Antique 😱 Rusty Tool Restoration – Lot Of Amazing,Nobody could guess this 100+ year antique rusty tool… ‎Watch this full restoration process as I bring this completely destroyed ...,Super Restoration,2026-04-23T13:12:01Z,6270,"antique restoration, rusty tool restoration, 100 year old tool, mystery tool restoration, nobody could guess, satisfying restoration, restoration video, amazing restoration, old tool repair, before after restoration, rusty tool, antique tool, restoration process, full restoration, satisfying video, viral restoration, extreme rust removal, restoration asmr, tool repair, old vs new
‎",49109,466,28,54329
XBSA_WLe8M4,https://www.youtube.com/watch?v=XBSA_WLe8M4,UCEsw0ejHSksi7aUpW9eZucg,dresser makeover,Thrifting My Smallest Bedroom: Space-Saving Finds + Makeover Plans,"In this video, I'm sharing a thrift haul focused on decor pieces and practical finds for a small space. I also show how I'm thinking ...",Janda Shamess,2026-05-06T20:00:00Z,13500,,35880,1685,54,53810
N4IHSzQ6QQE,https://www.youtube.com/watch?v=N4IHSzQ6QQE,UCf76T9N5p21HMDWhaWJzC2Q,angle grinder projects,Farmers Attach an Angle Grinder to a Bicycle! Turn Your Bike Into a Million-Dollar Electric Bike,"Hello everyone! You are watching video "" Farmers Attach an Angle Grinder to a Bicycle! Turn Your Bike Into a Million-Dollar ...",Inventor K,2026-04-30T13:00:45Z,618000,"DIY, Invention, Recycle, reuse, life hacks, unknown tips, crafts idea, INVENTOR K, electric bike, electric bicycle, ebike adapter, shaft motor, electric cycle, motorized bicycle, Mount the motor to the bicycle, 2 stroke engine, motorcycle, brushless motor, motorbike carbon brush, motorbike, mountain biking, mountain bike, Mechanicalize your bike, cutting machine, cutter, angle grinder, corner cutter, electric bikes, 3-function drill, Turn a bicycle into a simple electric bicycle",50056,289,35,53646
w0J6XIqFhiE,https://www.youtube.com/watch?v=w0J6XIqFhiE,UCEhIHEH3Z70htrkSN9Ic1Sw,furniture restoration,Restoration of a TEAL PAINTED Drop Leaf Table,Visit https://birchliving.com/projectsbyjamie for 27% off site-wide and be sure to mention my channel in their post-purchase survey!,Furniture Flippa | Projects by Jamie,2026-04-27T18:00:00Z,54800,"restoration, furniture restoration, furniture makeover, how to, paint stripping, drop leaf table, table restoration, furniture flippa, projects by jamie, before and after, drop leaf table ideas, refinish ideas, repair, real wood, solid wood, wood furniture, refinishing, how to refinish furniture, teal painted, paint stripper, mad city modern, woodworking, odies oil, sanding wood, restoration videos, restoration project, furniture restoration videos, furniture design, maple",27593,2191,164,52783
wQqfcnOaIuM,https://www.youtube.com/watch?v=wQqfcnOaIuM,UChRao90af6HJGA6e4zzsKVA,power tools latest use cases,They Built a ₹66 Cr Business From Fallen Leaves,Millions of areca palm leaves are discarded every year. Two founders from Karnataka saw an opportunity where others saw waste ...,Shosial,2026-05-30T11:30:33Z,32000,"agrileaf story, areca leaf plates business, eco friendly packaging india, sustainable startup india, plastic alternative packaging, green business ideas, startup india success story, agrileaf founders, environmental startup, food packaging business, entrepreneurship india, business case study india, waste to wealth business, eco friendly containers, viral business stories, shosial",51860,0,2,51900
UC4v32CLDZk,https://www.youtube.com/watch?v=UC4v32CLDZk,UC4CLQhVRKkMWUfXqKglc5hw,restoration hacks,They completely changed her room for Eid! 🌙,"The video begins with footage of a dilapidated room, then transitions to its cleaning and restoration. The restoration process ...",Deen & Dunya,2026-05-29T09:00:28Z,15700,"restoration, repair, cleaning vlog, deep cleaning, home organization",36694,1467,17,51704
ANHh90IdbjQ,https://www.youtube.com/watch?v=ANHh90IdbjQ,UCtFVSdKEbC0clVbhnwiZC9Q,impact driver uses,Top 10 Power Tools A Pro Carpenter Uses Everyday | UK Planet Tools,"Essential Carpentry & Joinery Tool Setup We teamed up with Lewis Lai (LL Carpentry & Joinery), a pro carpenter and joiner, ...",UK Planet Tools Ltd,2026-04-01T18:00:06Z,19000,"power tools, carpentry, joinery, woodworking tools, professional trades, hand tools, workshop tools",50633,65,2,51323
Jo8aQ9uxwmk,https://www.youtube.com/watch?v=Jo8aQ9uxwmk,UCd8v3SbzGP9_wuSOr_xk_eA,furniture restoration,I Restored a Chair With a Hidden Mechanism…,"Tom Johnson of Thomas Johnson Antique Furniture Restoration in Gorham, Maine restores this fascinating shaker tilting chair, ...",Thomas Johnson Antique Furniture Restoration,2026-04-17T12:00:39Z,169000,"Thomas, Johnson, Antique, Furniture, Restoration, Gorham, Maine, Southern, ME, Greater, Portland, Boston, MA, Newton, Mass",23327,2430,148,50587
_MT2CE9XsHk,https://www.youtube.com/watch?v=_MT2CE9XsHk,UCunHiYVUsh-T7pPoeqYsULw,cordless drill projects,"Once you know THIS SECRET, You&#39;ll NEVER buy drill Batteries again!","Hello everyone! You are watching video "" Once you know THIS SECRET, You'll NEVER buy drill Batteries again! "" I hope you ...",Gaus DIY,2026-05-02T14:00:05Z,375000,"diy, life hacks, Gaus DIY, crafts, tips and tricks, Invention, creative idea, DIY projects, how to make, tutorial, battery, reuse, mini spot welder, battery pack, litium battery, welding machine, 18650, Spot welder, DIY welding machine, how to make spot welder, home made welding machine, spot welding tutorial, easy welding machine, make a cheap battery welder, Battery store near me shared this method, Never buy drill batteries again, How to repair a drill battery with 1.5V battery",44381,446,32,49481
9wwUHs1lv04,https://www.youtube.com/watch?v=9wwUHs1lv04,UCCRhU9CwWCR1I4K0vTmZ4bw,tool restoration,Restoring a Rusty Blade Sharpener from mid-century #restorationvideo #asmr,"Watch this satisfying restoration transformation as I bring an old rusty item back to life. From heavy rust removal to deep cleaning, ...",Rust Bench,2026-05-26T03:00:15Z,3320,"restoration, satisfying restoration, rust removal, tool restoration, antique restoration, metal restoration, restoring old tools, vintage restoration, oddly satisfying, restoration videos, before and after restoration, restoration ASMR, DIY restoration, workshop restoration, rusty tools restoration, deep cleaning, satisfying videos, tool repair, restoring rusty items, metal polishing, cleaning rust, restoration project, old tool restoration, extreme restoration, shorts",42761,550,6,48381
OeNe4X43qsA,https://www.youtube.com/watch?v=OeNe4X43qsA,UCl1-RB3CtuRDNv3jAY1eUkQ,furniture restoration,Can This Outdated Pine Cabinet Be Saved?,"This old pine cabinet had an outdated finish, but I could see the potential. In this makeover, I take it from dated to clean, fresh and ...",Mayfield Restorations,2026-05-24T19:00:09Z,55700,"furniture makeover, furniture flip, cabinet makeover, pine cabinet makeover, pine furniture makeover, furniture restoration, DIY furniture makeover, painted furniture, modern furniture makeover, dated pine furniture, cabinet transformation, furniture refinishing, refinishing pine furniture, before and after furniture, how to refinish furniture, furniture restoration UK, modernising pine furniture, furniture painting, cabinet restoration, transforming old furniture",12575,2836,339,47715
1gTy_5v5EYw,https://www.youtube.com/watch?v=1gTy_5v5EYw,UCf_rZ7vi-f3bpRn4URZR57Q,construction power tool hacks,Beam Clamp Changed Everything #ConstructionHacks #ToolTok #BuilderLife,"Unknown original IG source, credit will be added immediately if identified. We respect all creators and fair-use transformation rules ...",Genius trick,2026-05-29T02:00:04Z,32700,"construction hacks, framing tool, beam clamp, roof framing, builder tools",46726,69,1,47436
P1BHdKKfHU8,https://www.youtube.com/watch?v=P1BHdKKfHU8,UC7TvL4GlQyMBLlUsTrN_C4Q,power tools latest use cases,How Can We Stop the Slop?!,"The IMA/#SolutionsWatch panel is back for another all-star debate/discussion/free-for-all. This time, we tackle the question of AI: ...",corbettreport,2026-05-29T09:36:24Z,559000,ai,16937,1359,690,44327
xe4KYxVTFi4,https://www.youtube.com/watch?v=xe4KYxVTFi4,UC8bYhuT5p6xncsk1CZAO1Fw,oscillating multi tool uses,How to Repair your Milwaukee Multi M18 FMT Multi tool at home for only 2 Euro. ,"No joke, never dump these Milwaukee multi tools. This is a very common failure, but it is so easy and cheap to fix. Anyone can do ...",Dean Doherty,2026-05-16T10:01:32Z,329000,"how to fix a milwaukee, milwaukee repair, repair it for 2 euro, power tool repair, workshop repairs, makita fix, makita vs milwaukee",24139,1697,108,43269
fTdba9qXB3Y,https://www.youtube.com/watch?v=fTdba9qXB3Y,UCHlAJrHyaAsIAcvFji7hKTQ,angle grinder projects,How To Turn An Angle Grinder Into Track Saw,Upgrade your workshop setup by building a custom guiding track. This simple woodworking project transforms your power grinder ...,HowItsDone,2026-05-22T12:00:30Z,24800,,41682,81,0,42492
_BLsEKvjUW0,https://www.youtube.com/watch?v=_BLsEKvjUW0,UCGAUHfGEpQ3ZKyxGfcF2kZA,angle grinder projects,Welding a Custom Angle Grinder Stand for Precision Pipe Cuts #process #welder #metalwork #grinder,"1. Project Overview This operation showcases the design and fabrication of a custom, homemade pipe cutting jig. By utilizing arc ...",Engineered World Beta,2026-05-26T23:12:04Z,17000,"#Engineering, #HowItWorks, #Machinery, #Technology, #Education, #Industry, #AgriTech, #Automation, #Manufacturing",41435,0,0,41435
uJBe4JYHHWA,https://www.youtube.com/watch?v=uJBe4JYHHWA,UCO1ZM4DsONdAWTQdX8o49QA,oscillating multi tool uses,Best Oscillating Multi Tool 2026,Best Cordless Oscillating Multi-Tool | Head-to-Head Test 2026 The Tool Lab looked at fifteen major brands of multi-tools and ...,Concord Carpenter | Tool Lab,2026-05-21T19:09:35Z,297000,"diy, tools, reviews, carpentry, remodel, construction, tool review, multi tool, multitool, OMT, dewalt, hilti, makita, milwaukee, bosch, Festool, MEtabo HPT",25392,881,344,41082
yIdQe23VmOs,https://www.youtube.com/watch?v=yIdQe23VmOs,UC5u803Jv60OMquJMtwUyoGg,dresser makeover,Nobody Wants Early 2000s Dressers Anymore... Until You Do This | Lemons To Lemonade Home,Nobody Wants Early 2000s Dressers Anymore | Lemons To Lemonade Home === Check out Pair Eyewear here ...,Lemons To Lemonade Home,2026-05-30T14:30:06Z,152000,"furniture makeover, interior design, Lemons To Lemonade Home, trash to treasure, DIY home projects, Lemons To Lemonade, how to flip furniture, furniture flipping, How to restore furniture, furniture design, painted furniture, furniture flipping teacher, vintage style, facebook marketplace furniture, upcycled furniture, how to paint furniture, DIY, old furniture, Lemons, 2000s Dressers Lemonade, furniture restoration, home decor, luxury home, Flip, Dresser Makeover, how to",23623,1613,63,41013
J1dWah8_t38,https://www.youtube.com/watch?v=J1dWah8_t38,UCunHiYVUsh-T7pPoeqYsULw,cordless drill projects,"Knowing this Secret, you&#39;ll never buy drill batteries again!","Never Buy Drill Batteries Again! (DIY Battery Repair & Rebuild Guide) In this video, I'll show you a practical method to restore a ...",Gaus DIY,2026-05-05T14:00:01Z,375000,"diy, Gaus DIY, invention, creative idea, DIY projects, how to make, tutorial, Repair, restoration, Restore, how to, mini spot welder, battery pack, litium battery, welding machine, 18650, Spot welder, DIY welding machine, how to make spot welder, home made welding machine, spot welding tutorial, How to repair drill battery, how to repair lithium battery, dead battery repair, Battery Won’t Charge, restore battery, Knowing this Secret, you'll never buy drill batteries again!",35555,405,21,40025
5nJoLuqb9Do,https://www.youtube.com/watch?v=5nJoLuqb9Do,UC_AH34G_3mHPYatykfM8pkQ,angle grinder projects,Amazing DIY Pipe Holder for Grinding | Genius Anti-Slip Steel Clamp,TITLE: Amazing DIY Pipe Holder for Grinding | Genius Anti-Slip Steel Clamp ALTERNATIVE TITLES: 1. Genius DIY Pipe Clamp ..., SmartTools,2026-05-24T20:00:15Z,20500,,38949,89,0,39839
_yr-ol4B8Go,https://www.youtube.com/watch?v=_yr-ol4B8Go,UCgViBKhOxI3T2SPu2pUlucA,furniture flip,JAW DROPPING Furniture Flips from the past 5 years on YouTube,"TFG has been on YouTube for FIVE years! This video showcases some of my absolute favourite projects over the years, including ...",Transcend Furniture Gallery,2026-04-12T18:14:55Z,298000,"furniture, furniture flipping, painted furniture, furniture painting, diy, diy furniture, repurposed, refinished furniture",14005,2171,206,39835
lVQhbdctrdM,https://www.youtube.com/watch?v=lVQhbdctrdM,UC68DctHZgXeKhu52X5YHIqA,woodworking power tools projects,Genius DIY Deck Post Cutting Jig: Perfect Curves Every Time!,"Check out this brilliant woodworking hack! In this video, a builder demonstrates an innovative way to cut a clean, precise curved ...",king-krafto,2026-05-29T02:00:03Z,11700,,38394,46,5,38954
jtHnB1VNppc,https://www.youtube.com/watch?v=jtHnB1VNppc,UC6BeryC8AcGYZYaYyIwSjmg,thrift flip,4 Boho Thrift Flips / Home decor &amp; Fashion,Hey love! Today I'm sharing 4 thrift flips that i created recently. I hope you enjoy them and let me know which one's your favorite!!!,Katia Nikolajew,2026-05-25T12:30:24Z,114000,"boho, home decor, bohemian, thrift haul, haul, boho diy, interior decor, interior decoration, home decor diy, diy room decor, home decorating ideas, diy home furniture, thrift, thrift shop, thrift with me, thrifting, come shopping, come shopping with me, home decor shopping, home decor ideas, home decor thrift haul, thrift flip, thrift flip decor",18497,1735,135,38547
t2z5ESPEuYg,https://www.youtube.com/watch?v=t2z5ESPEuYg,UCawPwx5Wmw-lRuu9YRI1FWg,woodworking power tools projects,Fastest Wood Slot Cutting Tool Ever! 🇺🇸🔥 #woodworking #tools #DIY,TITLE: Fastest Wood Slot Cutting Tool Ever! #woodworking #tools #DIY 3 HASHTAGS: #woodworking #tools #DIY ...,TRADISIONAL CARPENTRY,2026-05-29T14:00:19Z,20600,"woodworking
tools
DIY",37457,67,0,38127
zwiLDiBKQHU,https://www.youtube.com/watch?v=zwiLDiBKQHU,UC0-_eIa1FIFDXEw3V4BAcew,thrift flip,Thrift Store Flips &amp; a Baker&#39;s Rack Glow Up!,In today's video I've picked some items from my inventory to refresh and get them out of my storage space! Milk paint is perfect ...,Small Gestures Vintage and Crafts,2026-03-26T21:00:00Z,12200,"thrifted finds, upcycled decor, iron orchid designs, debi's design diary, diypaint, vintage finds, sweet pickins, milk paint, thrifted upcycles, estate sale finds, thriftstores",22636,1297,119,37986
u9lPKf2brHg,https://www.youtube.com/watch?v=u9lPKf2brHg,UCaX89cxwnyNn1U5tuT3FHMQ,thrift flip,a shirt don’t stand a chance with me 😭✂️ #shorts #sewing #thriftflip #upcycling #thrift,,Jada Kay,2026-05-26T00:00:17Z,28600,,22276,1462,16,37216
